batch,index,music,hashtag,author,likes,comments,shares,saves
1,0,original sound - YahneOfficialASMRBarbie,"facecard, asmrbarbie, asmr, asmrglue",yahneofficial,2700000,6166,136900,14400
1,1,,"@4x4studio, fyp, foryou, foryoupage, bestfriends, trio, besties, funny, dancetrend, trend, dance",,2100000,5618,145300,21200
1,2,,,,627600,5594,81500,12900
1,3,,"fyp, foryou, gaming, saloodz, foryoupage, trending, fortnite, fortnitetips",,195300,1909,18900,433
1,4,,"mom, momhack, hack, moms, baby, babies, motherhood, velcrow, toddler, babymama, momsoftiktok, fyp, momtok",,2400000,23800,171400,199900
1,5,,"fyp, viral, trending, twins",,666600,1303,105600,6551
1,6,,"meme, fyp, mascot, dancing, dream, real, relateable, school, job, foryou",,2600000,27900,301800,79200
1,7,,"fyp, dog",,669000,3966,75400,15800
1,8,,"joshhutcherson, fivenightsatfreddy",harry.daniels,12900000,139100,1300000,255100
1,9,,,,1000000,2659,108800,18600
1,10,,"cold, freezing, meme, fyp%E3%82%B7%E3%82%9Aviral, funny, relatable, fastfood",,120000,545,7872,2129
2,0,,"fy, foryou",,371900,2035,40000,2137
2,1,,fyp%E3%82%B7,,737300,2415,25700,6118
2,2,,"kaicenat, fyp",,761200,2458,63900,2319
2,3,,"tmnt, ninjaturtles, fyp, raphael, viral, trending",,1200000,9335,125600,17400
2,4,,"%D0%BD%D0%BE%D0%B2%D1%8B%D0%B9%D0%B3%D0%BE%D0%B4, %D0%BA%D0%BE%D1%82%D1%8F%D1%80%D0%B0, %D0%B6%D0%B8%D0%B7%D0%B5%D0%BD%D0%BD%D0%BE, 2024, %D0%BA%D0%BE%D1%82, %D1%81%D0%BD%D0%B0%D1%81%D1%82%D1%83%D0%BF%D0%B0%D1%8E%D1%89%D0%B8%D0%BC",,259399,1296,24200,17400
2,5,,"caraccessories, carplay, foryou",,205500,998,50400,11000
2,6,,"fyp, fortnite, fortniteclips, clutch, duo, squad",,1600000,18000,185400,35800
2,7,,"pawrenting101, pawrents, park, tank, yorkie, yorkiesoftiktok, sweaterweather, hoka, tank_ms, bestdayever",,3800000,8767,205100,144400
2,8,,"fyp%E3%82%B7, relatable, trending, aylecia, xybca",,265500,1062,41700,3756
2,9,,"capcutvelocity, rek, capcut_edit, capcut",,291600,1016,82300,2465
2,10,,,,269000,952,20300,3839
2,11,,"chainsfr, animation",,133800,415,16700,342
2,12,,fyp%E3%82%B7,,337800,1030,50300,2058
2,13,,,,1700000,6468,61000,5293
2,14,,"missycooper, foryou, foryoupage, fyp, actives, vsp, videostar, videostaredit, videostartutorial, coloringtutorial, videostarcoloring, vsedits, edit, qrcode, qrcodes, vsqrcodes, flopera, krissaily, strangerthings, strangerthingsedit, youngsheldon, missybeingmissy, georgecoopergettingroasted, stacyandmateo",,711000,4244,147000,2724
2,15,,"inverno, frio, estadosunidos",,192400,2322,5729,1406
2,16,,"jdkryptic, blowthisup, fyp, virelvideo, funny, fyp%E3%82%B7, xyzabc, abcxyz",,584500,7303,63200,4074
2,17,,"fyp, funny",,1100000,4316,81200,15600
2,18,,"capcut, glitter, roses",,709300,3497,100500,12200
2,19,,"keyboardasmr, keyboard, customizedkeyboard, cutekeyboard, keyboardart, lofree",,601400,22400,91000,28500
2,20,,"artistsoftiktok, tutorial, fyp%E3%82%B7, car, drawing",,309900,541,71400,1322
2,21,,"pov, relatable, backpack, highschool, fyp, fyp%E3%82%B7%E3%82%9Aviral, foryou, foryoupage, viral, comedy, funny, funnyvideos, comedyvideo, funnyvideo, onlydmc, imao, trynottolaugh, hilarious",,2700000,14600,340600,26500
2,22,,"viral, fu, moneytok",,189800,1791,24800,3256
2,23,,"fanpage, jaylee, jayleesanders, jayleeandjackson, scoli, scoliosis, scoliosischeck, scoliosisawareness, scoliosissurgery, scoliosisgang, scoliosistips, scoliosisfighter, scoliosisbrace, scoliosiswarrior, scoliosisproblems, scoliosisqueens, spinesurgery, youjustwentviral",,284100,2760,14000,3842
2,24,,"fortnite, fortniteclips, fortnitememes, petergriffin, petergriffinfortnite",,358100,2662,58500,6598
2,25,,"skit, comedy, memes, anime",,797400,2364,72100,7661
2,26,,"cute, rabbit",,864400,8767,56000,108000
3,0,Juju on That Beat (TZ Anthem) [Challenge Version] - Zay Hilfigerrr & Zayion McCall,"fyp, trio, @luhhmatt_, @whatsean",vinbabyy,186600,1317,21100,944
3,1,original sound - jovynn,"fyp, miami, artbaselmiami, artbasel, miamiproblems, hialeah, 305",imstephm_,1100000,12500,54800,25200
3,2,original sound - AMBER,"jakewebber, johnnieguilbert, fyp, jakeandjohnnie, foryoupage, foryou",itscatherineamber,377200,803,31200,735
3,3,original sound - American High Shorts,"americanhighshorts, jailbreak, iphonehack, tech",americanhighshorts,799500,1368,55100,1687
3,4,original sound - scarlett ʚɞ,"glitterroses, hellokitty, viral, share, repost, eternalroses, couquette, hellokitty, pink, glitter, roses, sparky, foreverroses, foryoupage, pinkbouquet%F0%9F%92%90, flowers, hellokittylover, hellokittybouquet, hellokitty%F0%9F%98%BB",quiroz_eternalroses111,5100000,41900,594200,90700
3,5,Party In The USA VS Loyal by 917Josh - 917Josh,"xyzbca, fyp, fyp%E3%82%B7, trending, trend, cheer, cheerleader, dancetrend, dance, basketball, basketballplayer, vs",meqionnn,1400000,10500,77800,1692
3,6,son original - Acoustic Music Song,"generations, generation, fyp, fyp%E3%82%B7, foryou, trending, fish, fishing, fishtok",lauren.canty,115200,6172,6088,1714
3,7,original sound - IridescentEthyn,"fortnite, fort, gaming, fun",iridescentethyn21,272100,1367,15100,1330
3,8,original sound - successandsu,,vampzvs,947200,1883,63300,576
3,9,original sound - $,,divinezay,5900000,7970,398100,106300
3,10,original sound - 🐞,"school, funny, viral, theonlyfamousbrian, relatable",onlyfamousbrian03,802800,2065,74200,5075
3,11,original sound - jaimewydd,"foryourpage, roblox, robloxedit, xyzbca, ttd3, fyp, mrworldwide, aftereffects",mrworldwidereturns,411200,6862,75500,7141
3,12,original sound - meredith on tour,"fyp, concert, oliviarodrigo, sourtour, gutstour",meredithontour,1300000,5396,114900,7028
3,13,original sound - ︎,"edit, basketball, stephcurry, popularvideo, famous, fyp",vs_uzi,392000,1164,51500,4732
3,14,yes and - chan,,ashleyb4253,555500,7174,49500,2648
3,15,original sound - Pop Hive by RapTV,rihanna,pophive,512700,1375,19800,1460
3,16,original sound - Cool Grandpa👴🏼,"greenscreen, grandpa, viral, funny, foryou, fyp%E3%82%B7, fypisbroken, jokes, cool, nostalgia, kids",theverycoolgrandpa,626600,9205,91600,7483
3,17,original sound - ★ seplix,,brookemonk_,996500,2351,51800,1317
3,18,original sound - Nutz💫☔️,"fyp%E3%82%B7, funny",tina_042,1500000,3045,119900,15300
3,19,original sound - Tra Rags,,ben.duong,599800,7479,43900,4637
3,20,original sound - gianna,"dogsoftiktok, dog, smartdog",giannamjoyce,560400,1945,37900,16600
3,21,original sound - ★𝐩𝐚𝐢𝐬𝐥𝐞𝐲★,"fyp%E3%82%B7, relatable, fyppppppppppppppppppppppp, realization, foryoupage, blowthisup, foryou, trending, thefloridaproject",morasecreate_page2,618300,12200,61200,5460
3,22,sonido original - Chachi _0102,"@iloverussellwilson, @888tweak, football, nba, kobe, soccer, neymar, fyp, foryou",zostyler,823700,2635,82200,1289
3,23,original sound - Nickweckerly,"capcut, fyp, pa, sunset",nickweckerly12,61700,382,15500,1176
3,24,original sound - American classic cars,,thecustomizedride,116600,1034,11100,9624
3,25,7AM (Slowed + Reverb) - adrian,"trending, gaming, viral, fortnite, fortniteog, foryoupage, mulletmace, fortnitetipsandtricks, fortnitezerobuild",mulletmace,907400,6730,274200,37300
3,26,original sound - Reed Shepherd,,reedshepherdfilms,1100000,576,30600,6181
3,27,original sound - Wood Studio,"woodworking, fyp, woodwork, wood_work, fyp%E3%82%B7, woodwoker, wood_art, woodart, asmr, woodproject, woodasmr, viral",woodstudio43,208700,1872,18700,8759
3,28,original sound - VXReel,"vfx, robotvaccuum, robotvacuumandmopcombo, robotvacuumcleaner",vxreel,221800,3718,18700,23600
4,0,Follow my insta - ‍,"shoeslaces, foryoupage%E2%9D%A4%EF%B8%8F%E2%9D%A4%EF%B8%8F, fyp%E3%82%B7, nike, airforce, viral, trending, sneakers",coco_kick.io,187100,215,57900,7519
4,1,just cant get enough - ‍r7ptor,"fyp, croptuck, boyfriend, outfit, essentials, matchingoutfits, lifehack, vacation, florida, ootd, grwm",zoemaries1,722600,1585,34100,582
4,2,original sound - Josh Liljenquist,,joshlilj,558700,1454,21000,663
4,3,Lovin On Me - Jack Harlow,"jackharlow, lovinonme, cats, rap, hiphop, raptok, cat, catsoftiktok, fyp",chillestcat,1800000,20900,211100,78800
4,4,original sound - chancei,"viral, fyp, fyp%E3%82%B7, foryou, fortnite, chapter5season1, ogfortnite, trend",chanceifn,122400,498,20100,671
4,5,som original - 〖ᴷⁱⁿᴳᴾᴵᴼᴿ_ᴰᴼᵁᴺᴵᵛᴱᴿˢᴼ⚔️⚔️,"irmaos, humor, foryou",bah_siilvestre,476200,2124,27600,3433
4,6,Cornfield Chase - Hans Zimmer,"hoteltips, hoteltrick, hotel, safety, lifehack, besafe, kidnappedinhotel, hotelsafetytips, hotelsafetyhacks, hotelsafe, hotelsafehack, viral, viralvideo, pageforyou, unlock, unlockdoors, fyp, foryou, xyzba, trending, trend, traveladvice, advice, traveltok, becareful, becarefull",victorias.way,149900,3417,20000,1560
4,7,GoodGooglyMooglyyy - Undergroundmusiclover,fyp,liayxo,1100000,8599,83000,10700
4,8,original sound - Fortnite clips,"fortnite, fortniteclips, omniman, omnimanfortnite",fortnite_clip_inc,1100000,4973,117400,8463
4,9,original sound - Deston 🧲,"@uncreative_mental, beamngdrive, cargames, racinggames, fh5, nfs",kassantii,440100,3413,71800,5389
4,10,original sound - Sarah,"hair, thin, thinhair, fyp, foryou, funny, pommesa, fyp%E3%82%B7",pommesa,401600,1864,13500,4691
4,11,"original sound - Sounds , dances, outfits,shoes","@lissethchavez_, therookie",jennadewan,236300,747,9582,494
4,12,Oi - My Soul Gone,"fyp, fortnite, fortniteclips, fortnitememes, fortnitefunny, fortnitedance, foryou, foryoupage, foryourpage, fyp%E3%82%B7, trending",whyisbottaken,1800000,6885,215100,21700
4,13,Baby By Me - Evil Empire,"zendaya, @cath7rsis, kcundercover, kcundercoveredits, zendayaedit, zendayacoleman, ae, adobeaftereffects, aftereffects, www4teen, fyp, fyp%E3%82%B7, fypage, fyp%E3%82%B7%E3%82%9Aviral, fyppppppppppppppppppppppp",www.4teen,392100,1983,68500,2116
4,14,オリジナル楽曲 - viola - Udon,"fyp, relatable, relationship, couple, viralvideo, gf, bf, huh, foryourpage",jnl.production,350400,2706,30300,2107
4,15,original sound - 🇹🇳THE LANGUAGE LORD🇹🇳,"navajo, navajonation, nativeamerican",merewana,161200,1769,9763,1222
4,16,original sound - Board Games for 2,"boardgames, gamenight, couple, fun",games4two,287700,388,5794,774
4,17,Rio romeo - 𝖑𝖚𝖍'🕷 ★,pou,pouplushiess,2400000,30400,251500,90900
4,18,Fluffing a Duck - Kevin MacLeod,"nicolassturniolo, @st7niolos, nicksturniolo, sturniolo, sturniolos, sturniolotriplets, nicksturnioloedit, nicolasstrunioloedit, sturnioloedit, sturniolotripletsedit, edit, fyp",sturnsf4v,473200,994,81800,797
4,19,I Wouldnt Mind - ♱,"fyp, foryou, foryoupage",caintrent,6200000,54500,500900,112300
4,20,original sound - Sarah Durnell,@adrianmiguelll,sarahdurnell,368500,1539,23800,4132
4,21,Aces (Sped Up Version) - dkj & sped up nightcore,"fortnite, fortnitechapter5, xpglitch, fortnitelevels, fortnitexpmaps",pzndo,726100,3703,255000,17900
4,22,Lovin On Me - Jack Harlow,"apple, applefeature",miss_mickeyy17,711800,2826,64400,11700
4,23,original sound - Slimmerjimmer,fyp,yanni_monettt,5200000,15000,245300,44800
4,24,original sound - Matt Mitchell,"stanleycup, comedy, sketch",alostrich,2400000,15000,112500,235400
4,25,Jaunty Gumption - Kevin MacLeod,"fyp, jakewebber, fy, artist, trend, drawing, viral, artwork, fyp%E3%82%B7%E3%82%9Aviral, fyp%E3%82%B7, sketch",widesquaretables,375800,8866,52200,2860
4,26,original sound - Toyy,"friends, paramore, herway, herwaychallenge, presidentdeborahalivilliams, deborahaliwilliams, floptok, flopera",toyyii_,226000,891,25900,1665
4,27,original sound - The Relationship Hub,benetnicole,_b.enet,293700,591,25400,1483
5,0,оригинальный звук - M 1 R A C L E,"roblox, robloxfyp, mm2, mm2roblox",willyandgaming,560500,3757,96000,2313
5,1,original sound - stephxlac,"pregnant, pregnanttiktok, pregnant%F0%9F%A4%B0, genderreveal, mom, parents",stephxlac,753000,6005,59500,2044
5,2,original sound - chancei,"viral, fyp, fyp%E3%82%B7, foryou, fortnite, chapter5season1, fortnitememes, fortniteclips",chanceifn,1700000,7407,242100,21800
5,3,original sound - McKenzi Brooke,"@taylorswift, @lanadelrey, taylorswift, lanadelrey, grammys, @grammys, @recordingacademy",mckenzibrooke,845200,827,40800,228
5,4,original sound - ྀི,"fyp, seraphsworld, bts, film",_seraphsworld_,469000,3105,45700,1112
5,5,son original - Adam kevin 🤎,"relatable, childhood, nostalgia, mom, laundry",the.swaggyb,3500000,7552,314200,34500
5,6,original sound - Playing In Makeup By Yolondo,"stitch, @chriseanrockbaby, fyp, beauty, shaderoom, makeuptutorial, makeupartist, beautyreview, fypage, viral, makeuptutorial, repost",yolondosalmon,2000000,16500,169600,12200
5,7,original sound - SPECIALK,"fyp, viral, orlandobrown",kburton_25,621200,9533,66100,30700
5,8,Love You So - The King Khan & BBQ Show,"basketball, fyp, foryou, fyp%E3%82%B7, foryourpage",mvpbasketball3.0,209700,144,13000,156
5,9,original sound - gallavichperks,"shameless, milkovich, fyp, xyzbca, mickymilkovich, mandymilkovich",gallavichperks,1300000,2214,212000,4803
5,10,原聲 - Hizeus,"phonecase, iphone15, cool, macha",hizeus1,174000,1231,21700,4006
5,11,original sound - Issa Hawk,,laibakhanofficial,560200,4994,38600,3968
5,12,original sound - Mary Allyson,"cake, cakedecorating, phoebethecake, phoebe2, 2024, cakeinspo, stitch, stitchcake, ohana, cakepiping, cakeart, caketok",mary_allyson,122900,6258,9955,856
5,13,Originalton - rebekahwing,"fyp, goviral, viral%3F, viral, fyp%E3%82%B7, real, makemefamous, makemeviral, xybca, musically, oldtrend, trending",assalll13,1100000,2486,90300,3871
5,14,original sound - prettyaxme,"dnd, yhauna, fyp, fypage, fy, foryoupage, foryou, fyp%E3%82%B7%E3%82%9Aviral, fypdongggggggg, fyppppppppppppppppppppppp, dontletthisflop, relatable, funny, viral, viralvideo, blowthisup, trending, flopada, flopera, floptok%F0%9F%98%8D%F0%9F%98%8D%F0%9F%98%AD%F0%9F%98%8C%F0%9F%A4%9E%F0%9F%92%85%F0%9F%92%85, floptok, makemefamous, xyzbca, xyzbcafyp%E3%82%B7, viraltiktok, tiktok, relateablecontent, ipad, stopflop%F0%9F%A5%B1",yhauna,1100000,4997,106500,6235
5,15,som original - aveerplayer-ĐƏ,"fortnite, fortnitebr, fortnitenostalgia, ogfortnite",guardian1k,145000,634,10700,170
5,16,original sound - Hippyt𖦹ri,"fortnitefunnymoments, fortnitefunnyclips, fortnitecontent, fortnitefunnyclips%F0%9F%98%82, trending, fortniteshortclips, fortnitefunnyfyp",hippytori,1700000,7260,268700,40700
5,17,original sound - Maddox Batson,"fyp, viral, blowthisup, zyxcba, maddoxbatson, countrymusic, martinguitar, country, charlieonnafriday, afterhours",maddoxbatson,310900,4134,31300,1958
5,18,original sound - Jillian !,"fyp, sick, cold, cough",harperzilmer4,530700,5347,41300,3998
5,19,PISTOL PACCIN - NLE Choppa & BigXthaPlug,,michelleotp,3300000,7708,156700,8114
5,20,original sound - CFN KASAI,"fyp, xybca, cfn, mamamoo",thiskasai,2700000,9009,257500,30200
5,21,sunet original - Victor drx99,,sophialoveramirez,489600,5035,50300,4998
5,22,original sound - snow💕,"chickenwang, huskiesoftiktok, dogtok, disableddogsoftiktok, dogsofttiktok, trexarms, dogsoftiktokviral",chickenwangblu,3900000,21500,248400,134600
5,23,original sound - Jett,"@sadieclarkkk, wonka, timothee, timotheechalamet, willywonka",errushka,380400,4346,37300,2797
5,24,original sound - niah <3,fyp,repscj_1,268500,1362,30200,1797
5,25,original sound - Drew 🇰🇭,@0fficial.va3h,prettyface_.faaith,2600000,8994,152200,31400
5,26,original sound - Mickey,"comedy, wow, funny, horror, squidward, mrkrabs, donaldduck, mickeymouse",mickey5206,83400,1579,22300,4629
5,27,original sound - Axel sixx,"@johnnieguilbertreal, @jakewebber9, foryoupageofficiall, fyp%E3%82%B7%E3%82%9Aviral, fyp%E3%82%B7%E3%82%9A, emo, music, jakewebber, jakewebber9, johnnieguilbert",curiosityki11s,1700000,12000,129100,45500
